{"kind":"graphty-document","version":1,"name":"friends","generator":{"name":"graphty-element","version":"1.10.0"},"requires":["graphty-data","graphty-session","graphty-results"],"members":[{"kind":"graphty-data","version":1,"format":"json","dialect":"node-link","graph":{"nodes":[{"id":"Ava"},{"id":"Ben"},{"id":"Chloe"},{"id":"Dev"},{"id":"Eli"},{"id":"Farah"},{"id":"Gus"},{"id":"Hana"},{"id":"Ivan"},{"id":"Jada"},{"id":"Kofi"},{"id":"Lena"},{"id":"Milo"},{"id":"Nora"},{"id":"Omar"},{"id":"Pia"},{"id":"Quinn"},{"id":"Ravi"},{"id":"Sana"},{"id":"Theo"}],"links":[{"weight":3,"source":"Ava","target":"Ben"},{"weight":5,"source":"Ava","target":"Chloe"},{"weight":2,"source":"Ava","target":"Dev"},{"weight":4,"source":"Ben","target":"Chloe"},{"weight":1,"source":"Ben","target":"Eli"},{"weight":3,"source":"Chloe","target":"Dev"},{"weight":2,"source":"Chloe","target":"Farah"},{"weight":4,"source":"Dev","target":"Eli"},{"weight":1,"source":"Dev","target":"Gus"},{"weight":3,"source":"Eli","target":"Farah"},{"weight":5,"source":"Farah","target":"Gus"},{"weight":2,"source":"Farah","target":"Hana"},{"weight":4,"source":"Gus","target":"Hana"},{"weight":1,"source":"Gus","target":"Ivan"},{"weight":3,"source":"Hana","target":"Ivan"},{"weight":2,"source":"Hana","target":"Jada"},{"weight":5,"source":"Ivan","target":"Jada"},{"weight":2,"source":"Ivan","target":"Kofi"},{"weight":4,"source":"Jada","target":"Kofi"},{"weight":1,"source":"Jada","target":"Lena"},{"weight":3,"source":"Kofi","target":"Lena"},{"weight":2,"source":"Kofi","target":"Milo"},{"weight":5,"source":"Lena","target":"Milo"},{"weight":1,"source":"Lena","target":"Nora"},{"weight":4,"source":"Milo","target":"Nora"},{"weight":2,"source":"Milo","target":"Omar"},{"weight":3,"source":"Nora","target":"Omar"},{"weight":1,"source":"Nora","target":"Pia"},{"weight":4,"source":"Omar","target":"Pia"},{"weight":2,"source":"Omar","target":"Quinn"},{"weight":5,"source":"Pia","target":"Quinn"},{"weight":3,"source":"Pia","target":"Ravi"},{"weight":2,"source":"Quinn","target":"Ravi"},{"weight":1,"source":"Quinn","target":"Sana"},{"weight":4,"source":"Ravi","target":"Sana"},{"weight":2,"source":"Ravi","target":"Theo"},{"weight":3,"source":"Sana","target":"Theo"},{"weight":1,"source":"Sana","target":"Ava"},{"weight":2,"source":"Theo","target":"Ben"},{"weight":1,"source":"Theo","target":"Ava"},{"weight":1,"source":"Ivan","target":"Ava"}]},"source":{"type":"csv","name":"friends.csv","size":500,"config":{}},"sources":[{"type":"csv","name":"friends.csv","size":500,"config":{},"tables":["friends.csv"],"tableRows":["edges"],"added":{"nodes":20,"edges":41}}]},{"kind":"graphty-session","version":1,"config":{"data":{"directed":"auto","knownFields":{"nodeIdPath":"id","nodeLabelPath":null,"nodeWeightPath":null,"nodeTimePath":null,"edgeSrcIdPath":null,"edgeDstIdPath":null,"edgeIdPath":null,"repeatedEdges":"keep","edgeWeightPath":"weight","edgeWeightMeaning":null,"edgeTimePath":null,"positionScale":1,"idCoercion":"canonical"}},"runAlgorithmsOnLoad":false,"background":{"backgroundType":"color","color":"#F5F5F5"},"selectionStyle":{"color":"#FFD700","scale":1.45,"opacity":0.4,"edgeColor":"#0077BB","edgeScale":2.5,"edgeOpacity":1},"layoutBehavior":{"preSteps":0,"stepMultiplier":1,"minDelta":0}},"layout":{"id":"force","engine":"ngraph","options":{"seed":1},"dimension":"3d"},"visibility":{"filter":null,"window":null,"showContext":false},"sets":[],"views":[]},{"kind":"graphty-arrangement","version":1,"ids":["Ava","Ben","Chloe","Dev","Eli","Farah","Gus","Hana","Ivan","Jada","Kofi","Lena","Milo","Nora","Omar","Pia","Quinn","Ravi","Sana","Theo"],"x":{"dtype":"f64","data":"AAAAYF3zFMAAAAAgQ2YqwAAAAOCHMuW/AAAAwKM0IsAAAABAgSAnwAAAAECY080/AAAAwKGhBsAAAAAAPDUbQAAAAMDp0BhAAAAAIPOULEAAAABADEcwQAAAAEB4uy9AAAAAAKD8MEAAAACAcosfQAAAAOAeohVAAAAAQKh4+b8AAABgI6EZwAAAAMD0EifAAAAAYL7vJMAAAACgr4UswA=="},"y":{"dtype":"f64","data":"AAAAAICdHMAAAAAgEb8rwAAAAEDotTHAAAAAABxxMsAAAABAzEc1wAAAAKDJzDTAAAAAoMBFJ8AAAABAKmAlwAAAAOAOoRbAAAAAIJgY+78AAADgAuvxPwAAAKCvHSJAAAAAAKF9K0AAAAAgGFkmQAAAAACYPjRAAAAAgGYOMEAAAADgMyQvQAAAAMCo0CJAAAAA4NzlEEAAAACAZkMHwA=="},"z":{"dtype":"f64","data":"AAAAQLgBBcAAAAAg0wkBwAAAAICYH/G/AAAAQFgo278AAADg0XwgQAAAAAASCCVAAAAAICKaH0AAAABAyz8qQAAAAEA0KghAAAAAAGLgIkAAAADA3ND0vwAAAMBNjRJAAAAAIIW7EcAAAABAEdoTwAAAACB/TgvAAAAAQFO8JcAAAACAoAb/vwAAAMClgiTAAAAAID4S9b8AAAAA6mEgwA=="},"pins":[]},{"kind":"graphty-results","version":1,"fingerprint":"f5f8b77673111ede","runs":[{"id":"pagerank","derived":false,"algorithm":"pagerank","shape":"node-metric","fields":[{"name":"value","plainName":"Influence","technicalName":"PageRank score","kind":"node","type":"number","path":"results.pagerank.value"},{"name":"rank","plainName":"Rank","technicalName":"rank","kind":"node","type":"integer","path":"results.pagerank.rank"},{"name":"percentile","plainName":"Percentile","technicalName":"percentile","kind":"node","type":"number","path":"results.pagerank.percentile"},{"name":"min","plainName":"Lowest","technicalName":"min","kind":"graph","type":"number","path":"results.pagerank.min"},{"name":"max","plainName":"Highest","technicalName":"max","kind":"graph","type":"number","path":"results.pagerank.max"},{"name":"median","plainName":"Middle","technicalName":"median","kind":"graph","type":"number","path":"results.pagerank.median"},{"name":"mean","plainName":"Average","technicalName":"mean","kind":"graph","type":"number","path":"results.pagerank.mean"},{"name":"measured","plainName":"Measured","technicalName":"measured","kind":"graph","type":"integer","path":"results.pagerank.measured"},{"name":"normalization","plainName":"Normalization","technicalName":"normalization","kind":"graph","type":"string","path":"results.pagerank.normalization"},{"name":"tiedAtMin","plainName":"Tied at the lowest value","technicalName":"tiedAtMin","kind":"graph","type":"integer","path":"results.pagerank.tiedAtMin"}],"measured":{"nodes":20,"edges":41},"graph":{"normalization":"none","min":0.03778981077653002,"max":0.06394200161148446,"median":0.04889233187191294,"mean":0.04999999999999999,"measured":20,"tiedAtMin":1},"caveats":{"exact":true,"seed":null,"direction":"directed","weight":{"attribute":"weight","meaning":"strength","assumed":true},"precision":"f64","method":"power-iteration","facts":[{"code":"pagerank.damping","params":{"dampingFactor":0.85}},{"code":"pagerank.sums-to-one","params":{}}],"notes":["A reader follows a link with probability 0.85 and jumps to a random node otherwise.","The ranks sum to 1 across the graph."],"converged":true,"iterations":53},"durationMs":1,"nodes":{"ids":["Ava","Ben","Chloe","Dev","Eli","Farah","Gus","Hana","Ivan","Jada","Kofi","Lena","Milo","Nora","Omar","Pia","Quinn","Ravi","Sana","Theo"],"columns":{"value":{"dtype":"f64","data":"xX/Qoi9Zoz9b8hLyrwyoP148Neixaqw/RRYJDC6fpT91bmV3mqGmP1EZw8WAXrA/apmhmX5kqz8yb4gq7mquPw8Bf/6AAqg/tNvGtO7vqj9AusBVaUKrPwHH51tXUqY/MDakCFzrrD/83R9nzmOnP4x3Gfrg8ao/lAerBj0UqD+q/TNPLkSoP6gOEd8dRKk/uIDUbGoIqT8VEzg/CPWqPw=="},"rank":{"dtype":"f64","data":"AAAAAAAANEAAAAAAAAAsQAAAAAAAABBAAAAAAAAAM0AAAAAAAAAxQAAAAAAAAPA/AAAAAAAAFEAAAAAAAAAAQAAAAAAAAC5AAAAAAAAAIkAAAAAAAAAYQAAAAAAAADJAAAAAAAAACEAAAAAAAAAwQAAAAAAAACBAAAAAAAAAKkAAAAAAAAAoQAAAAAAAACRAAAAAAAAAJkAAAAAAAAAcQA=="},"percentile":{"dtype":"f64","data":"mpmZmZmZqT9mZmZmZmbWPzMzMzMzM+s/mpmZmZmZuT+amZmZmZnJPwAAAAAAAPA/mpmZmZmZ6T9mZmZmZmbuPzMzMzMzM9M/MzMzMzMz4z8AAAAAAADoPzMzMzMzM8M/zczMzMzM7D8AAAAAAADQP83MzMzMzOQ/mpmZmZmZ2T/NzMzMzMzcP5qZmZmZmeE/AAAAAAAA4D9mZmZmZmbmPw=="}}},"edges":{"columns":{}}}]},{"kind":"graphty-style","version":1,"layers":[{"name":"Influence","target":"node","kind":"encoding","selector":{"match":"has","path":"results.pagerank.value"},"source":{"by":"run","runId":"pagerank","algorithm":"pagerank","params":{"dampingFactor":0.85,"maxIterations":100,"tolerance":0.000001,"useDelta":true}},"enabled":true,"encode":{"node.color":{"by":"results.pagerank.value","scale":"linear"},"node.size":{"by":"results.pagerank.value","scale":"linear","range":[1,3]}}}]},{"kind":"graphty-notes","version":1,"notes":[{"id":"note_01M4P0V8BV4MZGB51JFS7251GT","time":"2026-10-11T17:40:53.243Z","targets":[{"graph":true}],"text":"Spring list, checked against the sign-up sheet"},{"id":"note_01M4P0WJW3MTWDJPQK6J751WMY","time":"2026-10-11T17:41:36.771Z","targets":[{"node":"Farah"}],"text":"Moving away in May; ask who takes over the Tuesday run"}]},{"kind":"graphty-view-state","version":1,"selection":{"nodes":["Farah"],"edges":[]}}]}